"Status","Start Time","Stop Time","Duration in ms","Parent Suite","Suite","Sub Suite","Test Class","Test Method","Name","Description"
"passed","Fri Aug 25 20:06:29 GMT 2023","Fri Aug 25 20:06:35 GMT 2023","5476","storage","update bucket","","","","update bucket 1","update bucket should change bucket both public->private and back"
"failed","Fri Aug 25 20:09:17 GMT 2023","Fri Aug 25 20:09:23 GMT 2023","6015","auth_admin","","","","","delete user should work","When you delete user then this user has to be removed"
"failed","Fri Aug 25 20:09:48 GMT 2023","Fri Aug 25 20:09:51 GMT 2023","2674","postgrest","","","","","insert row","User can insert profile for himself according to RLS to profiles table"
"failed","Fri Aug 25 20:06:06 GMT 2023","Fri Aug 25 20:06:10 GMT 2023","3297","storage","user cannot create bucket because of RLS","","","","user cannot create bucket because of RLS 0","There has to be default RLS policy to not allow users to create bucket"
"failed","Fri Aug 25 20:09:39 GMT 2023","Fri Aug 25 20:09:39 GMT 2023","14","rpc","","","","","call rpc and get result","When you call rpc then you are able to receive its result"
"failed","Fri Aug 25 20:08:09 GMT 2023","Fri Aug 25 20:08:12 GMT 2023","2741","authentication","","","","","set session should set new auth","When user changes session then he still should be correctly logined"
"passed","Fri Aug 25 20:06:45 GMT 2023","Fri Aug 25 20:06:51 GMT 2023","6250","storage","","","","","list files","list files in bucket"
"failed","Fri Aug 25 20:07:53 GMT 2023","Fri Aug 25 20:08:00 GMT 2023","6529","authentication","","","","","signup should create user","When user sign up then corresponding user in auth schema should be created"
"passed","Fri Aug 25 20:06:24 GMT 2023","Fri Aug 25 20:06:29 GMT 2023","5393","storage","update bucket","","","","update bucket 0","update bucket should change bucket both public->private and back"
"failed","Fri Aug 25 20:08:29 GMT 2023","Fri Aug 25 20:08:39 GMT 2023","9658","auth_admin","","","","","list users with service key","When you list users then you should get all users"
"failed","Fri Aug 25 20:08:23 GMT 2023","Fri Aug 25 20:08:29 GMT 2023","6063","auth_admin","","","","","admin create user with logged in user should fail","When you try to create user as logged in user then you should get error"
"skipped","Fri Aug 25 20:09:59 GMT 2023","Fri Aug 25 20:09:59 GMT 2023","4","functions","","","","","set auth",""
"passed","Fri Aug 25 20:07:42 GMT 2023","Fri Aug 25 20:07:49 GMT 2023","6577","storage","","","","","update file","update file check if it will change"
"skipped","Fri Aug 25 20:08:12 GMT 2023","Fri Aug 25 20:08:12 GMT 2023","0","authentication","","","","","[skip-stage] on auth state changed should return events",""
"passed","Fri Aug 25 20:06:01 GMT 2023","Fri Aug 25 20:06:04 GMT 2023","2916","storage","create bucket","","","","create bucket 0","When you create public bucket then it has to be available"
"failed","Fri Aug 25 20:08:16 GMT 2023","Fri Aug 25 20:08:20 GMT 2023","3204","auth_admin","","","","","user created by admin can login","When you create user then he can sign in"
"failed","Fri Aug 25 20:10:00 GMT 2023","Fri Aug 25 20:10:04 GMT 2023","3271","triggers","","","","","trigger works","Insert user profile to trigger the a according trigger"
"passed","Fri Aug 25 20:08:39 GMT 2023","Fri Aug 25 20:08:47 GMT 2023","8583","auth_admin","","","","","list users with anon key should fail","When you try to list user with anon key then you should get error"
"passed","Fri Aug 25 20:06:51 GMT 2023","Fri Aug 25 20:06:58 GMT 2023","6244","storage","","","","","download file from bucket","download file"
"passed","Fri Aug 25 20:07:35 GMT 2023","Fri Aug 25 20:07:42 GMT 2023","6823","storage","get signed link to file","","","","get signed link to file 1","get signed link to file in the bucket"
"passed","Fri Aug 25 20:07:06 GMT 2023","Fri Aug 25 20:07:16 GMT 2023","9981","storage","","","","","[skip-local] copy file in bucket","copy file"
"skipped","Fri Aug 25 20:08:03 GMT 2023","Fri Aug 25 20:08:03 GMT 2023","0","authentication","","","","","create new users by phone auth",""
"passed","Fri Aug 25 20:07:16 GMT 2023","Fri Aug 25 20:07:22 GMT 2023","5809","storage","","","","","get public link to file","get public link to file in the public bucket"
"failed","Fri Aug 25 20:08:56 GMT 2023","Fri Aug 25 20:09:02 GMT 2023","5877","auth_admin","","","","","get user should work","When you get user by id he has to be returned"
"failed","Fri Aug 25 20:09:55 GMT 2023","Fri Aug 25 20:09:58 GMT 2023","2733","postgrest","","","","","delete row","User can delete his profile in profiles table"
"failed","Fri Aug 25 20:09:23 GMT 2023","Fri Aug 25 20:09:38 GMT 2023","15009","auth_admin","","","","","delete user with anon key should fail","When you delete user with anon key you have to receive an error"
"failed","Fri Aug 25 20:09:02 GMT 2023","Fri Aug 25 20:09:17 GMT 2023","15010","auth_admin","","","","","update user should work","When you update user then this user has to be updated"
"failed","Fri Aug 25 20:08:47 GMT 2023","Fri Aug 25 20:08:56 GMT 2023","8654","auth_admin","","","","","list users as logged in user should fail","When you try to list user as logged in user then you should get error"
"skipped","Fri Aug 25 20:08:09 GMT 2023","Fri Aug 25 20:08:09 GMT 2023","0","authentication","","","","","update user should update logged in user",""
"failed","Fri Aug 25 20:09:44 GMT 2023","Fri Aug 25 20:09:47 GMT 2023","2591","rpc","","","","","call rpc with head option","When you call rpc with head param, no data should be returned"
"failed","Fri Aug 25 20:09:51 GMT 2023","Fri Aug 25 20:09:53 GMT 2023","2137","postgrest","","","","","select row","User can select his profile from profiles table"
"failed","Fri Aug 25 20:08:13 GMT 2023","Fri Aug 25 20:08:16 GMT 2023","3324","auth_admin","","","","","create user via admin api","When you create user then it has to be in auth db schema"
"failed","Fri Aug 25 20:08:00 GMT 2023","Fri Aug 25 20:08:03 GMT 2023","3174","authentication","","","","","sing up new user and sign in","When user sign up then he should not be logged in until he confirms his email"
"failed","Fri Aug 25 20:08:03 GMT 2023","Fri Aug 25 20:08:06 GMT 2023","3245","authentication","","","","","existing users should be able to login","When user is already signed up then he should be able to log in"
"passed","Fri Aug 25 20:07:29 GMT 2023","Fri Aug 25 20:07:35 GMT 2023","6936","storage","get signed link to file","","","","get signed link to file 0","get signed link to file in the bucket"
"skipped","Fri Aug 25 20:08:56 GMT 2023","Fri Aug 25 20:08:56 GMT 2023","0","auth_admin","get url for provider","","","","get url for provider 0",""
"skipped","Fri Aug 25 20:08:56 GMT 2023","Fri Aug 25 20:08:56 GMT 2023","0","auth_admin","get url for provider","","","","get url for provider 1",""
"passed","Fri Aug 25 20:06:58 GMT 2023","Fri Aug 25 20:07:06 GMT 2023","8550","storage","","","","","[skip-local] move file in bucket","move file"
"passed","Fri Aug 25 20:08:20 GMT 2023","Fri Aug 25 20:08:23 GMT 2023","3190","auth_admin","","","","","admin create user with anon key should fail","When you try to create user with anon key then you should get error"
"failed","Fri Aug 25 20:09:39 GMT 2023","Fri Aug 25 20:09:44 GMT 2023","5045","rpc","","","","","call rpc method that has params","When you call rpc, params should be passed properly"
"passed","Fri Aug 25 20:06:19 GMT 2023","Fri Aug 25 20:06:24 GMT 2023","4777","storage","","","","","get bucket","get bucket should return bucket info"
"passed","Fri Aug 25 20:06:41 GMT 2023","Fri Aug 25 20:06:45 GMT 2023","4317","storage","","","","","upload to bucket","upload to bucket"
"failed","Fri Aug 25 20:06:10 GMT 2023","Fri Aug 25 20:06:12 GMT 2023","2792","storage","user cannot create bucket because of RLS","","","","user cannot create bucket because of RLS 1","There has to be default RLS policy to not allow users to create bucket"
"passed","Fri Aug 25 20:06:12 GMT 2023","Fri Aug 25 20:06:19 GMT 2023","6955","storage","","","","","list buckets as admin","list buckets should return all buckets"
"failed","Fri Aug 25 20:09:53 GMT 2023","Fri Aug 25 20:09:55 GMT 2023","2618","postgrest","","","","","update row","User can update his profile in profiles table"
"failed","Fri Aug 25 20:08:06 GMT 2023","Fri Aug 25 20:08:09 GMT 2023","2764","authentication","","","","","get user should return logged in user","When user is signed in then he should be able to get his info and metadata"
"passed","Fri Aug 25 20:06:35 GMT 2023","Fri Aug 25 20:06:41 GMT 2023","5927","storage","","","","","delete bucket","get bucket should return bucket info"
"passed","Fri Aug 25 20:07:22 GMT 2023","Fri Aug 25 20:07:29 GMT 2023","6556","storage","","","","","get public link to private file","get public link to file in the private bucket"
"skipped","Fri Aug 25 20:08:56 GMT 2023","Fri Aug 25 20:08:56 GMT 2023","1","auth_admin","get url for provider","","","","get url for provider 2",""
"passed","Fri Aug 25 20:06:04 GMT 2023","Fri Aug 25 20:06:06 GMT 2023","2660","storage","create bucket","","","","create bucket 1","When you create public bucket then it has to be available"
