"Status","Start Time","Stop Time","Duration in ms","Parent Suite","Suite","Sub Suite","Test Class","Test Method","Name","Description"
"skipped","Mon Jun 12 12:11:19 GMT 2023","Mon Jun 12 12:11:19 GMT 2023","0","realtime","subscribe on table with RLS","","","","subscribe on table with RLS 3",""
"passed","Mon Jun 12 12:12:45 GMT 2023","Mon Jun 12 12:12:50 GMT 2023","5490","auth_admin","","","","","list users with anon key should fail","When you try to list user with anon key then you should get error"
"skipped","Mon Jun 12 12:11:19 GMT 2023","Mon Jun 12 12:11:19 GMT 2023","0","realtime","multiple subscriptions","","","","multiple subscriptions 0",""
"skipped","Mon Jun 12 12:11:19 GMT 2023","Mon Jun 12 12:11:19 GMT 2023","0","realtime","subscribe on table","","","","subscribe on table 0",""
"passed","Mon Jun 12 12:09:12 GMT 2023","Mon Jun 12 12:09:14 GMT 2023","1961","storage","create bucket","","","","create bucket 1","When you create public bucket then it has to be available"
"passed","Mon Jun 12 12:11:12 GMT 2023","Mon Jun 12 12:11:17 GMT 2023","4393","realtime","","","","","you should get no events until subscribe","When you call ""on"" table but not subscribe then no events have to be returned"
"skipped","Mon Jun 12 12:18:39 GMT 2023","Mon Jun 12 12:18:39 GMT 2023","10","triggers","","","","","triggers work only once after pause/resume",""
"failed","Mon Jun 12 12:18:38 GMT 2023","Mon Jun 12 12:18:38 GMT 2023","33","data","","","","","storage data restored","Check if storage data is restored after pause/resume"
"skipped","Mon Jun 12 12:11:19 GMT 2023","Mon Jun 12 12:11:19 GMT 2023","0","realtime","subscribe on table with RLS","","","","subscribe on table with RLS 1",""
"passed","Mon Jun 12 12:10:43 GMT 2023","Mon Jun 12 12:10:48 GMT 2023","5646","storage","get signed link to file","","","","get signed link to file 0","get signed link to file in the bucket"
"passed","Mon Jun 12 12:10:03 GMT 2023","Mon Jun 12 12:10:10 GMT 2023","7094","storage","","","","","download file from bucket","download file"
"passed","Mon Jun 12 12:09:12 GMT 2023","Mon Jun 12 12:09:13 GMT 2023","131","home","","","","","get organizations","get organizations list"
"passed","Mon Jun 12 12:13:37 GMT 2023","Mon Jun 12 12:13:42 GMT 2023","5088","postgrest","","","","","update row","User can update his profile in profiles table"
"skipped","Mon Jun 12 12:11:19 GMT 2023","Mon Jun 12 12:11:19 GMT 2023","0","realtime","subscribe on table with RLS policies","","","","subscribe on table with RLS policies 0",""
"passed","Mon Jun 12 12:11:09 GMT 2023","Mon Jun 12 12:11:12 GMT 2023","3517","realtime","","","","","connect to realtime","When you call ""on"" table then connected realtime client should be returned"
"passed","Mon Jun 12 12:13:00 GMT 2023","Mon Jun 12 12:13:05 GMT 2023","5426","auth_admin","","","","","delete user should work","When you delete user then this user has to be removed"
"passed","Mon Jun 12 12:09:17 GMT 2023","Mon Jun 12 12:10:26 GMT 2023","69034","[gui] project","","","","","create project","create new project using gui dashboard"
"passed","Mon Jun 12 12:13:05 GMT 2023","Mon Jun 12 12:13:12 GMT 2023","6549","auth_admin","","","","","delete user with anon key should fail","When you delete user with anon key you have to receive an error"
"passed","Mon Jun 12 12:12:15 GMT 2023","Mon Jun 12 12:12:17 GMT 2023","2896","authentication","","","","","get user should return logged in user","When user is signed in then he should be able to get his info and metadata"
"passed","Mon Jun 12 12:12:00 GMT 2023","Mon Jun 12 12:12:07 GMT 2023","6617","authentication","","","","","sing up new user and sign in","When user sign up then he should not be logged in until he confirms his email"
"passed","Mon Jun 12 12:13:13 GMT 2023","Mon Jun 12 12:13:19 GMT 2023","5776","rpc","","","","","call rpc and get result","When you call rpc then you are able to receive its result"
"passed","Mon Jun 12 12:12:42 GMT 2023","Mon Jun 12 12:12:45 GMT 2023","3324","auth_admin","","","","","list users with service key","When you list users then you should get all users"
"passed","Mon Jun 12 12:09:26 GMT 2023","Mon Jun 12 12:09:32 GMT 2023","6396","storage","","","","","list buckets as admin","list buckets should return all buckets"
"skipped","Mon Jun 12 12:11:19 GMT 2023","Mon Jun 12 12:11:19 GMT 2023","0","realtime","subscribe on RLS table with service key","","","","subscribe on RLS table with service key 2",""
"passed","Mon Jun 12 12:13:33 GMT 2023","Mon Jun 12 12:13:37 GMT 2023","3842","postgrest","","","","","select row","User can select his profile from profiles table"
"passed","Mon Jun 12 12:07:20 GMT 2023","Mon Jun 12 12:07:20 GMT 2023","193","tables","","","","","get roles","get roles list"
"passed","Mon Jun 12 12:12:22 GMT 2023","Mon Jun 12 12:12:29 GMT 2023","6659","authentication","","","","","[skip-stage] on auth state changed should return events","When user subscribes on auth changes then user has to receive auth updates"
"passed","Mon Jun 12 12:10:31 GMT 2023","Mon Jun 12 12:10:33 GMT 2023","1534","users","","","","","[skip-stage] invite user","invite new user via dashboard api"
"skipped","Mon Jun 12 12:11:12 GMT 2023","Mon Jun 12 12:11:12 GMT 2023","1","realtime","","","","","[skip-local] receive event when connected to realtime",""
"skipped","Mon Jun 12 12:11:19 GMT 2023","Mon Jun 12 12:11:19 GMT 2023","1","realtime","subscribe on table with RLS","","","","subscribe on table with RLS 2",""
"passed","Mon Jun 12 12:09:14 GMT 2023","Mon Jun 12 12:09:20 GMT 2023","5915","storage","user cannot create bucket because of RLS","","","","user cannot create bucket because of RLS 0","There has to be default RLS policy to not allow users to create bucket"
"passed","Mon Jun 12 12:11:17 GMT 2023","Mon Jun 12 12:11:19 GMT 2023","2318","realtime","","","","","get supabase client subscriptions","When you create 2 subs (1 subscribed and 1 not yet) then both should be returned on get subs"
"passed","Mon Jun 12 12:10:19 GMT 2023","Mon Jun 12 12:10:29 GMT 2023","10145","storage","","","","","[skip-local] copy file in bucket","copy file"
"passed","Mon Jun 12 12:11:57 GMT 2023","Mon Jun 12 12:12:00 GMT 2023","2869","authentication","","","","","signup should create user","When user sign up then corresponding user in auth schema should be created"
"skipped","Mon Jun 12 12:11:19 GMT 2023","Mon Jun 12 12:11:19 GMT 2023","0","realtime","subscribe on table with RLS","","","","subscribe on table with RLS 0",""
"passed","Mon Jun 12 12:07:20 GMT 2023","Mon Jun 12 12:07:20 GMT 2023","193","tables","","","","","get publications","get publications list"
"passed","Mon Jun 12 12:13:30 GMT 2023","Mon Jun 12 12:13:33 GMT 2023","3464","postgrest","","","","","insert row","User can insert profile for himself according to RLS to profiles table"
"passed","Mon Jun 12 12:09:56 GMT 2023","Mon Jun 12 12:10:03 GMT 2023","7220","storage","","","","","list files","list files in bucket"
"passed","Mon Jun 12 12:12:58 GMT 2023","Mon Jun 12 12:13:00 GMT 2023","1651","auth_admin","","","","","update user should work","When you update user then this user has to be updated"
"skipped","Mon Jun 12 12:11:19 GMT 2023","Mon Jun 12 12:11:19 GMT 2023","0","realtime","subscribe on RLS table with service key","","","","subscribe on RLS table with service key 1",""
"passed","Mon Jun 12 12:12:33 GMT 2023","Mon Jun 12 12:12:36 GMT 2023","2675","auth_admin","","","","","admin create user with anon key should fail","When you try to create user with anon key then you should get error"
"passed","Mon Jun 12 12:09:20 GMT 2023","Mon Jun 12 12:09:26 GMT 2023","5695","storage","user cannot create bucket because of RLS","","","","user cannot create bucket because of RLS 1","There has to be default RLS policy to not allow users to create bucket"
"passed","Mon Jun 12 12:11:44 GMT 2023","Mon Jun 12 12:11:56 GMT 2023","12363","realtime","","","","","remove all subscriptions from client","When you remove all subscription then no events have to be returned"
"passed","Mon Jun 12 12:13:42 GMT 2023","Mon Jun 12 12:13:49 GMT 2023","6547","postgrest","","","","","delete row","User can delete his profile in profiles table"
"passed","Mon Jun 12 12:10:29 GMT 2023","Mon Jun 12 12:10:36 GMT 2023","7125","storage","","","","","get public link to file","get public link to file in the public bucket"
"passed","Mon Jun 12 12:11:19 GMT 2023","Mon Jun 12 12:11:31 GMT 2023","12410","realtime","","","","","unsubscribe from table","When you unsubscribe from table then no events have to be returned"
"passed","Mon Jun 12 12:09:12 GMT 2023","Mon Jun 12 12:09:12 GMT 2023","154","home","","","","","get projects","get projects list"
"skipped","Mon Jun 12 12:11:19 GMT 2023","Mon Jun 12 12:11:19 GMT 2023","0","realtime","subscribe on table with RLS policies","","","","subscribe on table with RLS policies 2",""
"passed","Mon Jun 12 12:12:36 GMT 2023","Mon Jun 12 12:12:42 GMT 2023","5709","auth_admin","","","","","admin create user with logged in user should fail","When you try to create user as logged in user then you should get error"
"passed","Mon Jun 12 12:09:32 GMT 2023","Mon Jun 12 12:09:36 GMT 2023","3402","storage","","","","","get bucket","get bucket should return bucket info"
"passed","Mon Jun 12 12:13:19 GMT 2023","Mon Jun 12 12:13:23 GMT 2023","4585","rpc","","","","","call rpc method that has params","When you call rpc, params should be passed properly"
"passed","Mon Jun 12 12:12:50 GMT 2023","Mon Jun 12 12:12:56 GMT 2023","5534","auth_admin","","","","","list users as logged in user should fail","When you try to list user as logged in user then you should get error"
"passed","Mon Jun 12 12:10:36 GMT 2023","Mon Jun 12 12:10:43 GMT 2023","6784","storage","","","","","get public link to private file","get public link to file in the private bucket"
"passed","Mon Jun 12 12:10:28 GMT 2023","Mon Jun 12 12:10:28 GMT 2023","185","api","","","","","get api service","get api service and project info"
"passed","Mon Jun 12 12:09:52 GMT 2023","Mon Jun 12 12:09:56 GMT 2023","4409","storage","","","","","upload to bucket","upload to bucket"
"failed","Mon Jun 12 12:18:39 GMT 2023","Mon Jun 12 12:18:39 GMT 2023","105","triggers","","","","","trigger works only once","Check if there are any duplicated in table with triggered inserts"
"passed","Mon Jun 12 12:09:47 GMT 2023","Mon Jun 12 12:09:52 GMT 2023","4928","storage","","","","","delete bucket","get bucket should return bucket info"
"passed","Mon Jun 12 12:07:16 GMT 2023","Mon Jun 12 12:07:17 GMT 2023","746","tables","","","","","get tables","get tables list"
"skipped","Mon Jun 12 12:12:56 GMT 2023","Mon Jun 12 12:12:56 GMT 2023","0","auth_admin","get url for provider","","","","get url for provider 2",""
"failed","Mon Jun 12 12:18:38 GMT 2023","Mon Jun 12 12:18:38 GMT 2023","16","data","","","","","profile data restored","Check if data is restored after pause/resume"
"passed","Mon Jun 12 12:09:36 GMT 2023","Mon Jun 12 12:09:41 GMT 2023","5514","storage","update bucket","","","","update bucket 0","update bucket should change bucket both public->private and back"
"passed","Mon Jun 12 12:09:09 GMT 2023","Mon Jun 12 12:09:12 GMT 2023","3381","storage","create bucket","","","","create bucket 0","When you create public bucket then it has to be available"
"skipped","Mon Jun 12 12:11:19 GMT 2023","Mon Jun 12 12:11:19 GMT 2023","0","realtime","subscribe on table","","","","subscribe on table 2",""
"skipped","Mon Jun 12 12:09:00 GMT 2023","Mon Jun 12 12:09:00 GMT 2023","1","[gui] support forms","","","","","contact enterprise sales",""
"skipped","Mon Jun 12 12:11:19 GMT 2023","Mon Jun 12 12:11:19 GMT 2023","0","realtime","","","","","subscribe from 2 clients",""
"skipped","Mon Jun 12 12:12:17 GMT 2023","Mon Jun 12 12:12:17 GMT 2023","1","authentication","","","","","update user should update logged in user",""
"skipped","Mon Jun 12 12:12:56 GMT 2023","Mon Jun 12 12:12:56 GMT 2023","1","auth_admin","get url for provider","","","","get url for provider 0",""
"passed","Mon Jun 12 12:12:31 GMT 2023","Mon Jun 12 12:12:33 GMT 2023","1731","auth_admin","","","","","user created by admin can login","When you create user then he can sign in"
"passed","Mon Jun 12 12:09:06 GMT 2023","Mon Jun 12 12:09:11 GMT 2023","5101","sql","","","","","create content","create new sql query in editor"
"passed","Mon Jun 12 12:07:20 GMT 2023","Mon Jun 12 12:07:20 GMT 2023","199","tables","","","","","get extensions","get extensions list"
"passed","Mon Jun 12 12:11:31 GMT 2023","Mon Jun 12 12:11:44 GMT 2023","12362","realtime","","","","","remove one subscription from client","When you remove one subscription then only events from another have to be returned"
"skipped","Mon Jun 12 12:11:19 GMT 2023","Mon Jun 12 12:11:19 GMT 2023","0","realtime","subscribe on table with RLS policies","","","","subscribe on table with RLS policies 1",""
"passed","Mon Jun 12 12:12:30 GMT 2023","Mon Jun 12 12:12:31 GMT 2023","1255","auth_admin","","","","","create user via admin api","When you create user then it has to be in auth db schema"
"skipped","Mon Jun 12 12:13:50 GMT 2023","Mon Jun 12 12:13:50 GMT 2023","4","functions","","","","","set auth",""
"skipped","Mon Jun 12 12:12:56 GMT 2023","Mon Jun 12 12:12:56 GMT 2023","1","auth_admin","get url for provider","","","","get url for provider 1",""
"skipped","Mon Jun 12 12:11:19 GMT 2023","Mon Jun 12 12:11:19 GMT 2023","0","realtime","subscribe on table with RLS policies","","","","subscribe on table with RLS policies 3",""
"passed","Mon Jun 12 12:07:23 GMT 2023","Mon Jun 12 12:09:00 GMT 2023","97142","[gui] support forms","","","","","[skip-stage] new ticket from project","create support request from project page"
"skipped","Mon Jun 12 12:11:19 GMT 2023","Mon Jun 12 12:11:19 GMT 2023","1","realtime","multiple subscriptions","","","","multiple subscriptions 1",""
"passed","Mon Jun 12 12:07:17 GMT 2023","Mon Jun 12 12:07:20 GMT 2023","2676","tables","","","","","add table","create table via dashboard API"
"passed","Mon Jun 12 12:12:11 GMT 2023","Mon Jun 12 12:12:15 GMT 2023","3865","authentication","","","","","existing users should be able to login","When user is already signed up then he should be able to log in"
"failed","Mon Jun 12 12:18:38 GMT 2023","Mon Jun 12 12:18:38 GMT 2023","49","data","","","","","login after restore","Check if user can login after pause/restore"
"failed","Mon Jun 12 12:18:38 GMT 2023","Mon Jun 12 12:18:38 GMT 2023","30","data","","","","","procedures data restored","Check if procedure is restored after pause/resume"
"passed","Mon Jun 12 12:10:10 GMT 2023","Mon Jun 12 12:10:19 GMT 2023","8194","storage","","","","","[skip-local] move file in bucket","move file"
"passed","Mon Jun 12 12:12:07 GMT 2023","Mon Jun 12 12:12:11 GMT 2023","3765","authentication","","","","","create new users by phone auth","When user sign up with phone then he should be logged in"
"skipped","Mon Jun 12 12:11:19 GMT 2023","Mon Jun 12 12:11:19 GMT 2023","1","realtime","subscribe on table","","","","subscribe on table 3",""
"passed","Mon Jun 12 12:07:17 GMT 2023","Mon Jun 12 12:07:17 GMT 2023","208","tables","","","","","get schemas","get schemas list"
"skipped","Mon Jun 12 12:11:19 GMT 2023","Mon Jun 12 12:11:19 GMT 2023","0","realtime","subscribe on table","","","","subscribe on table 1",""
"passed","Mon Jun 12 12:07:20 GMT 2023","Mon Jun 12 12:07:20 GMT 2023","200","tables","","","","","get triggers","get triggers list"
"passed","Mon Jun 12 12:12:56 GMT 2023","Mon Jun 12 12:12:58 GMT 2023","2210","auth_admin","","","","","get user should work","When you get user by id he has to be returned"
"passed","Mon Jun 12 12:09:41 GMT 2023","Mon Jun 12 12:09:47 GMT 2023","5504","storage","update bucket","","","","update bucket 1","update bucket should change bucket both public->private and back"
"skipped","Mon Jun 12 12:11:19 GMT 2023","Mon Jun 12 12:11:19 GMT 2023","1","realtime","subscribe on RLS table with service key","","","","subscribe on RLS table with service key 0",""
"passed","Mon Jun 12 12:10:34 GMT 2023","Mon Jun 12 12:10:38 GMT 2023","3943","storage","","","","","create storage bucket","create new storage bucket via API"
"skipped","Mon Jun 12 12:11:19 GMT 2023","Mon Jun 12 12:11:19 GMT 2023","0","realtime","multiple subscriptions","","","","multiple subscriptions 2",""
"passed","Mon Jun 12 12:09:13 GMT 2023","Mon Jun 12 12:09:13 GMT 2023","214","home","","","","","get project settings","get project settings"
"passed","Mon Jun 12 12:13:23 GMT 2023","Mon Jun 12 12:13:29 GMT 2023","5171","rpc","","","","","call rpc with head option","When you call rpc with head param, no data should be returned"
"passed","Mon Jun 12 12:10:48 GMT 2023","Mon Jun 12 12:10:55 GMT 2023","7102","storage","get signed link to file","","","","get signed link to file 1","get signed link to file in the bucket"
"passed","Mon Jun 12 12:12:17 GMT 2023","Mon Jun 12 12:12:22 GMT 2023","4463","authentication","","","","","set session should set new auth","When user changes session then he still should be correctly logined"
"passed","Mon Jun 12 12:09:14 GMT 2023","Mon Jun 12 12:09:15 GMT 2023","1143","home","","","","","supabase auth is working in project","check supabase clients works correctly"
"passed","Mon Jun 12 12:13:51 GMT 2023","Mon Jun 12 12:13:55 GMT 2023","3415","triggers","","","","","trigger works","Insert user profile to trigger the a according trigger"
"passed","Mon Jun 12 12:09:13 GMT 2023","Mon Jun 12 12:09:14 GMT 2023","1328","home","","","","","get project","get project"
"skipped","Mon Jun 12 12:11:19 GMT 2023","Mon Jun 12 12:11:19 GMT 2023","1","realtime","subscribe on RLS table with service key","","","","subscribe on RLS table with service key 3",""
"passed","Mon Jun 12 12:10:55 GMT 2023","Mon Jun 12 12:11:04 GMT 2023","8647","storage","","","","","update file","update file check if it will change"
"passed","Mon Jun 12 12:10:40 GMT 2023","Mon Jun 12 12:10:40 GMT 2023","177","settings","","","","","get postgrest settings","get api service (postgrest) settings list"
