"Status","Start Time","Stop Time","Duration in ms","Parent Suite","Suite","Sub Suite","Test Class","Test Method","Name","Description"
"passed","Tue Oct 31 06:11:34 GMT 2023","Tue Oct 31 06:11:40 GMT 2023","5226","storage","update bucket","","","","update bucket 0","update bucket should change bucket both public->private and back"
"passed","Tue Oct 31 06:04:43 GMT 2023","Tue Oct 31 06:04:44 GMT 2023","801","api","","","","","get api service","get api service and project info"
"passed","Tue Oct 31 06:13:59 GMT 2023","Tue Oct 31 06:14:01 GMT 2023","2684","postgrest","","","","","insert row","User can insert profile for himself according to RLS to profiles table"
"passed","Tue Oct 31 06:12:06 GMT 2023","Tue Oct 31 06:12:14 GMT 2023","7805","storage","","","","","[skip-local] move file in bucket","move file"
"skipped","Tue Oct 31 06:13:21 GMT 2023","Tue Oct 31 06:13:21 GMT 2023","1","auth_admin","get url for provider","","","","get url for provider 2",""
"passed","Tue Oct 31 06:03:35 GMT 2023","Tue Oct 31 06:03:36 GMT 2023","1224","tables","","","","","get extensions","get extensions list"
"passed","Tue Oct 31 06:11:25 GMT 2023","Tue Oct 31 06:11:31 GMT 2023","6292","storage","","","","","list buckets as admin","list buckets should return all buckets"
"skipped","Tue Oct 31 06:11:01 GMT 2023","Tue Oct 31 06:11:01 GMT 2023","1","triggers","","","","","triggers work only once after pause/resume",""
"passed","Tue Oct 31 06:13:40 GMT 2023","Tue Oct 31 06:13:46 GMT 2023","5646","authentication","","","","","sing up new user and sign in","When user sign up then he should not be logged in until he confirms his email"
"passed","Tue Oct 31 06:03:36 GMT 2023","Tue Oct 31 06:03:38 GMT 2023","1117","tables","","","","","get publications","get publications list"
"passed","Tue Oct 31 06:03:57 GMT 2023","Tue Oct 31 06:03:59 GMT 2023","1446","home","","","","","get project","get project"
"passed","Tue Oct 31 06:12:20 GMT 2023","Tue Oct 31 06:12:25 GMT 2023","4646","storage","","","","","get public link to file","get public link to file in the public bucket"
"passed","Tue Oct 31 06:13:50 GMT 2023","Tue Oct 31 06:13:54 GMT 2023","3294","authentication","","","","","get user should return logged in user","When user is signed in then he should be able to get his info and metadata"
"passed","Tue Oct 31 06:03:14 GMT 2023","Tue Oct 31 06:03:32 GMT 2023","18464","tables","","","","","add table","create table via dashboard API"
"passed","Tue Oct 31 06:14:19 GMT 2023","Tue Oct 31 06:14:24 GMT 2023","5560","rpc","","","","","call rpc and get result","When you call rpc then you are able to receive its result"
"skipped","Tue Oct 31 06:04:47 GMT 2023","Tue Oct 31 06:04:47 GMT 2023","6","storage","","","","","create storage bucket",""
"passed","Tue Oct 31 06:13:37 GMT 2023","Tue Oct 31 06:13:40 GMT 2023","2951","authentication","","","","","signup should create user","When user sign up then corresponding user in auth schema should be created"
"skipped","Tue Oct 31 06:13:21 GMT 2023","Tue Oct 31 06:13:21 GMT 2023","0","auth_admin","get url for provider","","","","get url for provider 0",""
"skipped","Tue Oct 31 06:14:38 GMT 2023","Tue Oct 31 06:14:38 GMT 2023","4","functions","","","","","set auth",""
"skipped","Tue Oct 31 06:03:42 GMT 2023","Tue Oct 31 06:03:42 GMT 2023","1","forms","","","","","[skip-stage] product feedback submissions",""
"passed","Tue Oct 31 06:13:06 GMT 2023","Tue Oct 31 06:13:09 GMT 2023","2874","auth_admin","","","","","list users with service key","When you list users then you should get all users"
"passed","Tue Oct 31 06:14:11 GMT 2023","Tue Oct 31 06:14:18 GMT 2023","6789","postgrest","","","","","delete row","User can delete his profile in profiles table"
"passed","Tue Oct 31 06:03:32 GMT 2023","Tue Oct 31 06:03:34 GMT 2023","1324","tables","","","","","get roles","get roles list"
"skipped","Tue Oct 31 06:13:57 GMT 2023","Tue Oct 31 06:13:57 GMT 2023","0","authentication","","","","","[skip-stage] on auth state changed should return events",""
"passed","Tue Oct 31 06:10:48 GMT 2023","Tue Oct 31 06:10:49 GMT 2023","1221","data","","","","","login after restore","Check if user can login after pause/restore"
"passed","Tue Oct 31 06:12:37 GMT 2023","Tue Oct 31 06:12:44 GMT 2023","6550","storage","get signed link to file","","","","get signed link to file 1","get signed link to file in the bucket"
"passed","Tue Oct 31 06:14:24 GMT 2023","Tue Oct 31 06:14:29 GMT 2023","4464","rpc","","","","","call rpc method that has params","When you call rpc, params should be passed properly"
"passed","Tue Oct 31 06:12:55 GMT 2023","Tue Oct 31 06:12:56 GMT 2023","1111","auth_admin","","","","","create user via admin api","When you create user then it has to be in auth db schema"
"passed","Tue Oct 31 06:03:45 GMT 2023","Tue Oct 31 06:03:52 GMT 2023","7516","sql","","","","","create content","create new sql query in editor"
"skipped","Tue Oct 31 06:03:42 GMT 2023","Tue Oct 31 06:03:42 GMT 2023","6","forms","","","","","[skip-stage] exit surveys",""
"passed","Tue Oct 31 06:03:10 GMT 2023","Tue Oct 31 06:03:13 GMT 2023","2066","tables","","","","","get tables","get tables list"
"passed","Tue Oct 31 06:14:06 GMT 2023","Tue Oct 31 06:14:11 GMT 2023","4965","postgrest","","","","","update row","User can update his profile in profiles table"
"passed","Tue Oct 31 06:14:34 GMT 2023","Tue Oct 31 06:14:37 GMT 2023","2868","triggers","","","","","trigger works","Insert user profile to trigger the a according trigger"
"skipped","Tue Oct 31 06:04:46 GMT 2023","Tue Oct 31 06:04:46 GMT 2023","6","users","","","","","[skip-stage] invite user",""
"passed","Tue Oct 31 06:14:29 GMT 2023","Tue Oct 31 06:14:33 GMT 2023","4017","rpc","","","","","call rpc with head option","When you call rpc with head param, no data should be returned"
"passed","Tue Oct 31 06:10:51 GMT 2023","Tue Oct 31 06:10:54 GMT 2023","2731","data","","","","","storage data restored","Check if storage data is restored after pause/resume"
"passed","Tue Oct 31 06:04:50 GMT 2023","Tue Oct 31 06:04:50 GMT 2023","625","settings","","","","","get postgrest settings","get api service (postgrest) settings list"
"passed","Tue Oct 31 06:03:56 GMT 2023","Tue Oct 31 06:03:56 GMT 2023","490","home","","","","","get organizations","get organizations list"
"passed","Tue Oct 31 06:10:54 GMT 2023","Tue Oct 31 06:10:55 GMT 2023","1041","data","","","","","procedures data restored","Check if procedure is restored after pause/resume"
"passed","Tue Oct 31 06:11:31 GMT 2023","Tue Oct 31 06:11:34 GMT 2023","3170","storage","","","","","get bucket","get bucket should return bucket info"
"skipped","Tue Oct 31 06:03:42 GMT 2023","Tue Oct 31 06:03:42 GMT 2023","1","forms","","","","","[skip-stage] feedback submissions",""
"passed","Tue Oct 31 06:12:31 GMT 2023","Tue Oct 31 06:12:37 GMT 2023","6445","storage","get signed link to file","","","","get signed link to file 0","get signed link to file in the bucket"
"passed","Tue Oct 31 06:11:13 GMT 2023","Tue Oct 31 06:11:19 GMT 2023","5908","storage","user cannot create bucket because of RLS","","","","user cannot create bucket because of RLS 0","There has to be default RLS policy to not allow users to create bucket"
"skipped","Tue Oct 31 06:13:54 GMT 2023","Tue Oct 31 06:13:54 GMT 2023","1","authentication","","","","","update user should update logged in user",""
"passed","Tue Oct 31 06:10:49 GMT 2023","Tue Oct 31 06:10:51 GMT 2023","2202","data","","","","","profile data restored","Check if data is restored after pause/resume"
"skipped","Tue Oct 31 06:13:46 GMT 2023","Tue Oct 31 06:13:46 GMT 2023","1","authentication","","","","","create new users by phone auth",""
"passed","Tue Oct 31 06:03:56 GMT 2023","Tue Oct 31 06:03:57 GMT 2023","1179","home","","","","","get project settings","get project settings"
"passed","Tue Oct 31 06:11:45 GMT 2023","Tue Oct 31 06:11:50 GMT 2023","5427","storage","","","","","delete bucket","get bucket should return bucket info"
"passed","Tue Oct 31 06:03:13 GMT 2023","Tue Oct 31 06:03:14 GMT 2023","1228","tables","","","","","get schemas","get schemas list"
"skipped","Tue Oct 31 06:13:21 GMT 2023","Tue Oct 31 06:13:21 GMT 2023","1","auth_admin","get url for provider","","","","get url for provider 1",""
"passed","Tue Oct 31 06:11:19 GMT 2023","Tue Oct 31 06:11:25 GMT 2023","5702","storage","user cannot create bucket because of RLS","","","","user cannot create bucket because of RLS 1","There has to be default RLS policy to not allow users to create bucket"
"passed","Tue Oct 31 06:14:01 GMT 2023","Tue Oct 31 06:14:06 GMT 2023","4504","postgrest","","","","","select row","User can select his profile from profiles table"
"skipped","Tue Oct 31 06:03:40 GMT 2023","Tue Oct 31 06:03:40 GMT 2023","7","[gui] support forms","","","","","[skip-stage] new ticket from project",""
"passed","Tue Oct 31 06:13:24 GMT 2023","Tue Oct 31 06:13:29 GMT 2023","4809","auth_admin","","","","","delete user should work","When you delete user then this user has to be removed"
"skipped","Tue Oct 31 06:03:40 GMT 2023","Tue Oct 31 06:03:40 GMT 2023","1","[gui] support forms","","","","","contact enterprise sales",""
"passed","Tue Oct 31 06:13:46 GMT 2023","Tue Oct 31 06:13:50 GMT 2023","4862","authentication","","","","","existing users should be able to login","When user is already signed up then he should be able to log in"
"passed","Tue Oct 31 06:12:25 GMT 2023","Tue Oct 31 06:12:31 GMT 2023","5784","storage","","","","","get public link to private file","get public link to file in the private bucket"
"passed","Tue Oct 31 06:03:59 GMT 2023","Tue Oct 31 06:04:02 GMT 2023","3303","home","","","","","supabase auth is working in project","check supabase clients works correctly"
"passed","Tue Oct 31 06:11:11 GMT 2023","Tue Oct 31 06:11:13 GMT 2023","2509","storage","create bucket","","","","create bucket 1","When you create public bucket then it has to be available"
"passed","Tue Oct 31 06:12:44 GMT 2023","Tue Oct 31 06:12:51 GMT 2023","6726","storage","","","","","update file","update file check if it will change"
"passed","Tue Oct 31 06:10:56 GMT 2023","Tue Oct 31 06:11:01 GMT 2023","5103","triggers","","","","","trigger works only once","Check if there are any duplicated in table with triggered inserts"
"passed","Tue Oct 31 06:12:56 GMT 2023","Tue Oct 31 06:12:58 GMT 2023","2231","auth_admin","","","","","user created by admin can login","When you create user then he can sign in"
"passed","Tue Oct 31 06:13:22 GMT 2023","Tue Oct 31 06:13:24 GMT 2023","1602","auth_admin","","","","","update user should work","When you update user then this user has to be updated"
"passed","Tue Oct 31 06:03:55 GMT 2023","Tue Oct 31 06:03:56 GMT 2023","1265","home","","","","","get projects","get projects list"
"passed","Tue Oct 31 06:12:00 GMT 2023","Tue Oct 31 06:12:06 GMT 2023","6390","storage","","","","","download file from bucket","download file"
"passed","Tue Oct 31 06:11:50 GMT 2023","Tue Oct 31 06:11:54 GMT 2023","3228","storage","","","","","upload to bucket","upload to bucket"
"passed","Tue Oct 31 06:13:54 GMT 2023","Tue Oct 31 06:13:57 GMT 2023","3674","authentication","","","","","set session should set new auth","When user changes session then he still should be correctly logined"
"passed","Tue Oct 31 06:13:29 GMT 2023","Tue Oct 31 06:13:36 GMT 2023","7221","auth_admin","","","","","delete user with anon key should fail","When you delete user with anon key you have to receive an error"
"passed","Tue Oct 31 06:11:40 GMT 2023","Tue Oct 31 06:11:45 GMT 2023","5239","storage","update bucket","","","","update bucket 1","update bucket should change bucket both public->private and back"
"passed","Tue Oct 31 06:12:14 GMT 2023","Tue Oct 31 06:12:20 GMT 2023","6347","storage","","","","","[skip-local] copy file in bucket","copy file"
"passed","Tue Oct 31 06:12:58 GMT 2023","Tue Oct 31 06:13:01 GMT 2023","3025","auth_admin","","","","","admin create user with anon key should fail","When you try to create user with anon key then you should get error"
"passed","Tue Oct 31 06:13:09 GMT 2023","Tue Oct 31 06:13:14 GMT 2023","5258","auth_admin","","","","","list users with anon key should fail","When you try to list user with anon key then you should get error"
"passed","Tue Oct 31 06:13:01 GMT 2023","Tue Oct 31 06:13:06 GMT 2023","5289","auth_admin","","","","","admin create user with logged in user should fail","When you try to create user as logged in user then you should get error"
"passed","Tue Oct 31 06:03:34 GMT 2023","Tue Oct 31 06:03:35 GMT 2023","1626","tables","","","","","get triggers","get triggers list"
"passed","Tue Oct 31 06:13:21 GMT 2023","Tue Oct 31 06:13:22 GMT 2023","1692","auth_admin","","","","","get user should work","When you get user by id he has to be returned"
"passed","Tue Oct 31 06:11:54 GMT 2023","Tue Oct 31 06:12:00 GMT 2023","6290","storage","","","","","list files","list files in bucket"
"passed","Tue Oct 31 06:11:08 GMT 2023","Tue Oct 31 06:11:11 GMT 2023","2730","storage","create bucket","","","","create bucket 0","When you create public bucket then it has to be available"
"passed","Tue Oct 31 06:13:14 GMT 2023","Tue Oct 31 06:13:21 GMT 2023","6108","auth_admin","","","","","list users as logged in user should fail","When you try to list user as logged in user then you should get error"
"failed","Tue Oct 31 06:04:04 GMT 2023","Tue Oct 31 06:04:40 GMT 2023","35756","[gui] project","","","","","create project","create new project using gui dashboard"
