"Status","Start Time","Stop Time","Duration in ms","Parent Suite","Suite","Sub Suite","Test Class","Test Method","Name","Description"
"passed","Sun Apr 09 08:32:30 GMT 2023","Sun Apr 09 08:32:33 GMT 2023","3225","realtime","","","","","you should get no events until subscribe","When you call ""on"" table but not subscribe then no events have to be returned"
"passed","Sun Apr 09 08:34:16 GMT 2023","Sun Apr 09 08:34:18 GMT 2023","1934","triggers","","","","","trigger works","Insert user profile to trigger the a according trigger"
"passed","Sun Apr 09 07:04:42 GMT 2023","Sun Apr 09 07:05:23 GMT 2023","40635","[gui] support forms","","","","","[skip-stage] new ticket from project","create support request from project page"
"passed","Sun Apr 09 08:33:46 GMT 2023","Sun Apr 09 08:33:49 GMT 2023","2612","auth_admin","","","","","delete user should work","When you delete user then this user has to be removed"
"skipped","Sun Apr 09 08:32:35 GMT 2023","Sun Apr 09 08:32:35 GMT 2023","1","realtime","multiple subscriptions","","","","multiple subscriptions 0",""
"passed","Sun Apr 09 08:31:27 GMT 2023","Sun Apr 09 08:31:30 GMT 2023","3367","storage","user cannot create bucket because of RLS","","","","user cannot create bucket because of RLS 0","There has to be default RLS policy to not allow users to create bucket"
"passed","Sun Apr 09 08:33:13 GMT 2023","Sun Apr 09 08:33:16 GMT 2023","3509","authentication","","","","","sing up new user and sign in","When user sign up then he should not be logged in until he confirms his email"
"skipped","Sun Apr 09 08:32:35 GMT 2023","Sun Apr 09 08:32:35 GMT 2023","0","realtime","","","","","subscribe from 2 clients",""
"passed","Sun Apr 09 08:33:31 GMT 2023","Sun Apr 09 08:33:32 GMT 2023","1051","auth_admin","","","","","user created by admin can login","When you create user then he can sign in"
"passed","Sun Apr 09 08:33:44 GMT 2023","Sun Apr 09 08:33:45 GMT 2023","1319","auth_admin","","","","","get user should work","When you get user by id he has to be returned"
"passed","Sun Apr 09 08:34:05 GMT 2023","Sun Apr 09 08:34:07 GMT 2023","1543","postgrest","","","","","insert row","User can insert profile for himself according to RLS to profiles table"
"skipped","Sun Apr 09 08:32:35 GMT 2023","Sun Apr 09 08:32:35 GMT 2023","0","realtime","subscribe on table","","","","subscribe on table 1",""
"passed","Sun Apr 09 08:33:58 GMT 2023","Sun Apr 09 08:34:01 GMT 2023","2463","rpc","","","","","call rpc method that has params","When you call rpc, params should be passed properly"
"passed","Sun Apr 09 08:31:08 GMT 2023","Sun Apr 09 08:31:12 GMT 2023","3770","triggers","","","","","trigger works only once","Check if there are any duplicated in table with triggered inserts"
"passed","Sun Apr 09 08:32:58 GMT 2023","Sun Apr 09 08:33:09 GMT 2023","11215","realtime","","","","","remove all subscriptions from client","When you remove all subscription then no events have to be returned"
"passed","Sun Apr 09 08:31:23 GMT 2023","Sun Apr 09 08:31:25 GMT 2023","2313","storage","create bucket","","","","create bucket 0","When you create public bucket then it has to be available"
"passed","Sun Apr 09 08:31:42 GMT 2023","Sun Apr 09 08:31:45 GMT 2023","2452","storage","update bucket","","","","update bucket 1","update bucket should change bucket both public->private and back"
"passed","Sun Apr 09 08:33:38 GMT 2023","Sun Apr 09 08:33:40 GMT 2023","2346","auth_admin","","","","","list users with anon key should fail","When you try to list user with anon key then you should get error"
"passed","Sun Apr 09 08:33:25 GMT 2023","Sun Apr 09 08:33:29 GMT 2023","4443","authentication","","","","","[skip-stage] on auth state changed should return events","When user subscribes on auth changes then user has to receive auth updates"
"skipped","Sun Apr 09 08:32:35 GMT 2023","Sun Apr 09 08:32:35 GMT 2023","0","realtime","subscribe on table with RLS","","","","subscribe on table with RLS 2",""
"skipped","Sun Apr 09 08:32:30 GMT 2023","Sun Apr 09 08:32:30 GMT 2023","1","realtime","","","","","[skip-local] receive event when connected to realtime",""
"passed","Sun Apr 09 08:32:05 GMT 2023","Sun Apr 09 08:32:08 GMT 2023","3781","storage","","","","","get public link to file","get public link to file in the public bucket"
"skipped","Sun Apr 09 08:32:35 GMT 2023","Sun Apr 09 08:32:35 GMT 2023","0","realtime","multiple subscriptions","","","","multiple subscriptions 1",""
"skipped","Sun Apr 09 08:32:35 GMT 2023","Sun Apr 09 08:32:35 GMT 2023","1","realtime","subscribe on table with RLS","","","","subscribe on table with RLS 3",""
"passed","Sun Apr 09 08:32:27 GMT 2023","Sun Apr 09 08:32:30 GMT 2023","3009","realtime","","","","","connect to realtime","When you call ""on"" table then connected realtime client should be returned"
"passed","Sun Apr 09 08:31:59 GMT 2023","Sun Apr 09 08:32:05 GMT 2023","5355","storage","","","","","[skip-local] copy file in bucket","copy file"
"skipped","Sun Apr 09 08:33:44 GMT 2023","Sun Apr 09 08:33:44 GMT 2023","0","auth_admin","get url for provider","","","","get url for provider 2",""
"passed","Sun Apr 09 08:34:11 GMT 2023","Sun Apr 09 08:34:15 GMT 2023","3538","postgrest","","","","","delete row","User can delete his profile in profiles table"
"skipped","Sun Apr 09 08:33:44 GMT 2023","Sun Apr 09 08:33:44 GMT 2023","1","auth_admin","get url for provider","","","","get url for provider 0",""
"passed","Sun Apr 09 07:04:40 GMT 2023","Sun Apr 09 07:04:40 GMT 2023","424","tables","","","","","get publications","get publications list"
"passed","Sun Apr 09 07:06:40 GMT 2023","Sun Apr 09 07:06:45 GMT 2023","4306","storage","","","","","create storage bucket","create new storage bucket via API"
"passed","Sun Apr 09 07:04:40 GMT 2023","Sun Apr 09 07:04:40 GMT 2023","421","tables","","","","","get extensions","get extensions list"
"skipped","Sun Apr 09 08:32:35 GMT 2023","Sun Apr 09 08:32:35 GMT 2023","0","realtime","subscribe on table","","","","subscribe on table 3",""
"passed","Sun Apr 09 07:04:39 GMT 2023","Sun Apr 09 07:04:39 GMT 2023","420","tables","","","","","get roles","get roles list"
"passed","Sun Apr 09 08:31:45 GMT 2023","Sun Apr 09 08:31:47 GMT 2023","2554","storage","","","","","delete bucket","get bucket should return bucket info"
"passed","Sun Apr 09 07:05:33 GMT 2023","Sun Apr 09 07:05:35 GMT 2023","1582","home","","","","","supabase auth is working in project","check supabase clients works correctly"
"passed","Sun Apr 09 08:32:35 GMT 2023","Sun Apr 09 08:32:46 GMT 2023","11186","realtime","","","","","unsubscribe from table","When you unsubscribe from table then no events have to be returned"
"skipped","Sun Apr 09 08:33:44 GMT 2023","Sun Apr 09 08:33:44 GMT 2023","1","auth_admin","get url for provider","","","","get url for provider 1",""
"passed","Sun Apr 09 08:32:17 GMT 2023","Sun Apr 09 08:32:20 GMT 2023","3042","storage","get signed link to file","","","","get signed link to file 1","get signed link to file in the bucket"
"passed","Sun Apr 09 07:05:32 GMT 2023","Sun Apr 09 07:05:32 GMT 2023","85","home","","","","","get organizations","get organizations list"
"passed","Sun Apr 09 07:04:39 GMT 2023","Sun Apr 09 07:04:40 GMT 2023","455","tables","","","","","get triggers","get triggers list"
"passed","Sun Apr 09 08:31:47 GMT 2023","Sun Apr 09 08:31:49 GMT 2023","2084","storage","","","","","upload to bucket","upload to bucket"
"skipped","Sun Apr 09 08:32:35 GMT 2023","Sun Apr 09 08:32:35 GMT 2023","1","realtime","subscribe on table with RLS policies","","","","subscribe on table with RLS policies 0",""
"passed","Sun Apr 09 08:33:11 GMT 2023","Sun Apr 09 08:33:13 GMT 2023","1815","authentication","","","","","signup should create user","When user sign up then corresponding user in auth schema should be created"
"passed","Sun Apr 09 08:31:49 GMT 2023","Sun Apr 09 08:31:53 GMT 2023","3060","storage","","","","","list files","list files in bucket"
"passed","Sun Apr 09 08:31:00 GMT 2023","Sun Apr 09 08:31:01 GMT 2023","1070","data","","","","","login after restore","Check if user can login after pause/restore"
"skipped","Sun Apr 09 08:32:35 GMT 2023","Sun Apr 09 08:32:35 GMT 2023","1","realtime","subscribe on table with RLS","","","","subscribe on table with RLS 1",""
"passed","Sun Apr 09 08:31:39 GMT 2023","Sun Apr 09 08:31:42 GMT 2023","2944","storage","update bucket","","","","update bucket 0","update bucket should change bucket both public->private and back"
"passed","Sun Apr 09 07:06:35 GMT 2023","Sun Apr 09 07:06:35 GMT 2023","191","api","","","","","get api service","get api service and project info"
"passed","Sun Apr 09 08:31:01 GMT 2023","Sun Apr 09 08:31:03 GMT 2023","1660","data","","","","","profile data restored","Check if data is restored after pause/resume"
"skipped","Sun Apr 09 08:32:35 GMT 2023","Sun Apr 09 08:32:35 GMT 2023","0","realtime","multiple subscriptions","","","","multiple subscriptions 2",""
"skipped","Sun Apr 09 08:32:35 GMT 2023","Sun Apr 09 08:32:35 GMT 2023","0","realtime","subscribe on RLS table with service key","","","","subscribe on RLS table with service key 0",""
"passed","Sun Apr 09 07:05:32 GMT 2023","Sun Apr 09 07:05:32 GMT 2023","113","home","","","","","get projects","get projects list"
"passed","Sun Apr 09 07:05:25 GMT 2023","Sun Apr 09 07:05:31 GMT 2023","5697","sql","","","","","create content","create new sql query in editor"
"skipped","Sun Apr 09 07:05:23 GMT 2023","Sun Apr 09 07:05:23 GMT 2023","0","[gui] support forms","","","","","contact enterprise sales",""
"skipped","Sun Apr 09 08:31:12 GMT 2023","Sun Apr 09 08:31:12 GMT 2023","1","triggers","","","","","triggers work only once after pause/resume",""
"passed","Sun Apr 09 08:33:45 GMT 2023","Sun Apr 09 08:33:46 GMT 2023","1308","auth_admin","","","","","update user should work","When you update user then this user has to be updated"
"skipped","Sun Apr 09 08:32:35 GMT 2023","Sun Apr 09 08:32:35 GMT 2023","0","realtime","subscribe on table","","","","subscribe on table 0",""
"passed","Sun Apr 09 08:34:09 GMT 2023","Sun Apr 09 08:34:11 GMT 2023","2680","postgrest","","","","","update row","User can update his profile in profiles table"
"passed","Sun Apr 09 08:33:21 GMT 2023","Sun Apr 09 08:33:23 GMT 2023","1863","authentication","","","","","get user should return logged in user","When user is signed in then he should be able to get his info and metadata"
"passed","Sun Apr 09 08:31:05 GMT 2023","Sun Apr 09 08:31:06 GMT 2023","781","data","","","","","procedures data restored","Check if procedure is restored after pause/resume"
"passed","Sun Apr 09 08:33:23 GMT 2023","Sun Apr 09 08:33:25 GMT 2023","1928","authentication","","","","","set session should set new auth","When user changes session then he still should be correctly logined"
"passed","Sun Apr 09 08:31:34 GMT 2023","Sun Apr 09 08:31:37 GMT 2023","3478","storage","","","","","list buckets as admin","list buckets should return all buckets"
"skipped","Sun Apr 09 08:32:35 GMT 2023","Sun Apr 09 08:32:35 GMT 2023","0","realtime","subscribe on table with RLS policies","","","","subscribe on table with RLS policies 3",""
"passed","Sun Apr 09 08:31:25 GMT 2023","Sun Apr 09 08:31:27 GMT 2023","1545","storage","create bucket","","","","create bucket 1","When you create public bucket then it has to be available"
"passed","Sun Apr 09 08:33:18 GMT 2023","Sun Apr 09 08:33:21 GMT 2023","2730","authentication","","","","","existing users should be able to login","When user is already signed up then he should be able to log in"
"passed","Sun Apr 09 08:31:03 GMT 2023","Sun Apr 09 08:31:05 GMT 2023","2195","data","","","","","storage data restored","Check if storage data is restored after pause/resume"
"skipped","Sun Apr 09 08:32:35 GMT 2023","Sun Apr 09 08:32:35 GMT 2023","0","realtime","subscribe on table with RLS","","","","subscribe on table with RLS 0",""
"passed","Sun Apr 09 08:31:37 GMT 2023","Sun Apr 09 08:31:39 GMT 2023","1995","storage","","","","","get bucket","get bucket should return bucket info"
"passed","Sun Apr 09 08:32:20 GMT 2023","Sun Apr 09 08:32:23 GMT 2023","3851","storage","","","","","update file","update file check if it will change"
"skipped","Sun Apr 09 08:31:21 GMT 2023","Sun Apr 09 08:31:21 GMT 2023","10","functions","","","","","set auth",""
"passed","Sun Apr 09 07:05:32 GMT 2023","Sun Apr 09 07:05:32 GMT 2023","170","home","","","","","get project settings","get project settings"
"passed","Sun Apr 09 07:06:37 GMT 2023","Sun Apr 09 07:06:39 GMT 2023","1836","users","","","","","[skip-stage] invite user","invite new user via dashboard api"
"passed","Sun Apr 09 08:33:32 GMT 2023","Sun Apr 09 08:33:34 GMT 2023","1276","auth_admin","","","","","admin create user with anon key should fail","When you try to create user with anon key then you should get error"
"skipped","Sun Apr 09 08:32:35 GMT 2023","Sun Apr 09 08:32:35 GMT 2023","0","realtime","subscribe on table with RLS policies","","","","subscribe on table with RLS policies 2",""
"passed","Sun Apr 09 08:32:33 GMT 2023","Sun Apr 09 08:32:35 GMT 2023","1746","realtime","","","","","get supabase client subscriptions","When you create 2 subs (1 subscribed and 1 not yet) then both should be returned on get subs"
"skipped","Sun Apr 09 08:33:23 GMT 2023","Sun Apr 09 08:33:23 GMT 2023","1","authentication","","","","","update user should update logged in user",""
"passed","Sun Apr 09 08:32:46 GMT 2023","Sun Apr 09 08:32:58 GMT 2023","11219","realtime","","","","","remove one subscription from client","When you remove one subscription then only events from another have to be returned"
"passed","Sun Apr 09 08:33:54 GMT 2023","Sun Apr 09 08:33:58 GMT 2023","4119","rpc","","","","","call rpc and get result","When you call rpc then you are able to receive its result"
"skipped","Sun Apr 09 08:32:35 GMT 2023","Sun Apr 09 08:32:35 GMT 2023","0","realtime","subscribe on table","","","","subscribe on table 2",""
"passed","Sun Apr 09 08:33:31 GMT 2023","Sun Apr 09 08:33:31 GMT 2023","572","auth_admin","","","","","create user via admin api","When you create user then it has to be in auth db schema"
"passed","Sun Apr 09 07:04:32 GMT 2023","Sun Apr 09 07:04:33 GMT 2023","1274","tables","","","","","get tables","get tables list"
"skipped","Sun Apr 09 08:32:35 GMT 2023","Sun Apr 09 08:32:35 GMT 2023","0","realtime","subscribe on RLS table with service key","","","","subscribe on RLS table with service key 2",""
"passed","Sun Apr 09 08:31:53 GMT 2023","Sun Apr 09 08:31:56 GMT 2023","3459","storage","","","","","download file from bucket","download file"
"passed","Sun Apr 09 08:34:07 GMT 2023","Sun Apr 09 08:34:09 GMT 2023","1939","postgrest","","","","","select row","User can select his profile from profiles table"
"passed","Sun Apr 09 08:32:08 GMT 2023","Sun Apr 09 08:32:13 GMT 2023","4330","storage","","","","","get public link to private file","get public link to file in the private bucket"
"skipped","Sun Apr 09 08:32:35 GMT 2023","Sun Apr 09 08:32:35 GMT 2023","0","realtime","subscribe on RLS table with service key","","","","subscribe on RLS table with service key 1",""
"passed","Sun Apr 09 08:33:49 GMT 2023","Sun Apr 09 08:33:52 GMT 2023","3346","auth_admin","","","","","delete user with anon key should fail","When you delete user with anon key you have to receive an error"
"passed","Sun Apr 09 07:04:33 GMT 2023","Sun Apr 09 07:04:33 GMT 2023","491","tables","","","","","get schemas","get schemas list"
"passed","Sun Apr 09 07:05:32 GMT 2023","Sun Apr 09 07:05:33 GMT 2023","863","home","","","","","get project","get project"
"passed","Sun Apr 09 07:05:36 GMT 2023","Sun Apr 09 07:06:34 GMT 2023","58232","[gui] project","","","","","create project","create new project using gui dashboard"
"passed","Sun Apr 09 08:32:13 GMT 2023","Sun Apr 09 08:32:17 GMT 2023","3741","storage","get signed link to file","","","","get signed link to file 0","get signed link to file in the bucket"
"skipped","Sun Apr 09 08:32:35 GMT 2023","Sun Apr 09 08:32:35 GMT 2023","0","realtime","subscribe on RLS table with service key","","","","subscribe on RLS table with service key 3",""
"passed","Sun Apr 09 08:31:56 GMT 2023","Sun Apr 09 08:31:59 GMT 2023","3329","storage","","","","","[skip-local] move file in bucket","move file"
"passed","Sun Apr 09 08:33:16 GMT 2023","Sun Apr 09 08:33:18 GMT 2023","1850","authentication","","","","","create new users by phone auth","When user sign up with phone then he should be logged in"
"passed","Sun Apr 09 08:34:01 GMT 2023","Sun Apr 09 08:34:03 GMT 2023","2774","rpc","","","","","call rpc with head option","When you call rpc with head param, no data should be returned"
"passed","Sun Apr 09 08:31:30 GMT 2023","Sun Apr 09 08:31:34 GMT 2023","3711","storage","user cannot create bucket because of RLS","","","","user cannot create bucket because of RLS 1","There has to be default RLS policy to not allow users to create bucket"
"passed","Sun Apr 09 08:33:36 GMT 2023","Sun Apr 09 08:33:38 GMT 2023","1468","auth_admin","","","","","list users with service key","When you list users then you should get all users"
"passed","Sun Apr 09 08:33:40 GMT 2023","Sun Apr 09 08:33:44 GMT 2023","3551","auth_admin","","","","","list users as logged in user should fail","When you try to list user as logged in user then you should get error"
"passed","Sun Apr 09 07:06:46 GMT 2023","Sun Apr 09 07:06:46 GMT 2023","118","settings","","","","","get postgrest settings","get api service (postgrest) settings list"
"skipped","Sun Apr 09 08:32:35 GMT 2023","Sun Apr 09 08:32:35 GMT 2023","1","realtime","subscribe on table with RLS policies","","","","subscribe on table with RLS policies 1",""
"passed","Sun Apr 09 07:04:33 GMT 2023","Sun Apr 09 07:04:39 GMT 2023","5290","tables","","","","","add table","create table via dashboard API"
"passed","Sun Apr 09 08:33:34 GMT 2023","Sun Apr 09 08:33:36 GMT 2023","2789","auth_admin","","","","","admin create user with logged in user should fail","When you try to create user as logged in user then you should get error"
